{
  "success": true,
  "category": "success",
  "routines": [
    {
      "schedule_id": 1,
      "schedule": {
        "job_type": "shuffle",
        "target_playlist_id": "alice-mix",
        "target_playlist_name": "Alice mix",
        "source_playlist_ids": [],
        "algorithm_name": "BasicShuffle",
        "algorithm_params": {
          "keep_first": 1
        },
        "schedule_type": "interval",
        "schedule_value": "daily",
        "timezone": "UTC",
        "id": 1,
        "user_id": 1,
        "is_enabled": true,
        "last_run_at": "2026-01-01T12:00:00+00:00",
        "last_status": "success",
        "last_error": null,
        "created_at": "2026-01-01T12:00:00+00:00",
        "updated_at": "2026-01-01T12:00:00+00:00"
      },
      "definition": {
        "job_type": "shuffle",
        "target_playlist_id": "alice-mix",
        "target_playlist_name": "Alice mix",
        "source_playlist_ids": [],
        "algorithm_name": "BasicShuffle",
        "algorithm_params": {
          "keep_first": 1
        },
        "schedule_type": "interval",
        "schedule_value": "daily",
        "timezone": "UTC"
      },
      "schedule_revision": "fixture-revision",
      "timing": {
        "kind": "interval",
        "interval": "daily",
        "timezone": "UTC",
        "text": "Every day",
        "schedule_type": "interval",
        "schedule_value": "daily",
        "effective_timezone": "UTC",
        "legacy": false,
        "explanation": null
      },
      "registration": {
        "status": "registered",
        "next_run_at": "2026-01-01T12:00:00+00:00",
        "effective_timezone": "UTC"
      },
      "state": "active",
      "state_label": "Active"
    },
    {
      "schedule_id": 2,
      "schedule": {
        "job_type": "shuffle",
        "target_playlist_id": "alice-mix",
        "target_playlist_name": "Alice mix",
        "source_playlist_ids": [],
        "algorithm_name": "BasicShuffle",
        "algorithm_params": {
          "keep_first": 1
        },
        "schedule_type": "cron",
        "schedule_value": "30 9 * * *",
        "timezone": "UTC",
        "id": 2,
        "user_id": 1,
        "is_enabled": false,
        "last_run_at": "2026-01-01T12:00:00+00:00",
        "last_status": "success",
        "last_error": null,
        "created_at": "2026-01-01T12:00:00+00:00",
        "updated_at": "2026-01-01T12:00:00+00:00"
      },
      "definition": {
        "job_type": "shuffle",
        "target_playlist_id": "alice-mix",
        "target_playlist_name": "Alice mix",
        "source_playlist_ids": [],
        "algorithm_name": "BasicShuffle",
        "algorithm_params": {
          "keep_first": 1
        },
        "schedule_type": "cron",
        "schedule_value": "30 9 * * *",
        "timezone": "UTC"
      },
      "schedule_revision": "fixture-revision",
      "timing": {
        "kind": "daily",
        "timezone": "UTC",
        "text": "Every day",
        "schedule_type": "cron",
        "schedule_value": "30 9 * * *",
        "effective_timezone": "UTC",
        "legacy": false,
        "explanation": null,
        "time": "09:30"
      },
      "registration": {
        "status": "paused",
        "next_run_at": null,
        "effective_timezone": "UTC"
      },
      "state": "paused",
      "state_label": "Paused"
    },
    {
      "schedule_id": 3,
      "schedule": {
        "job_type": "shuffle",
        "target_playlist_id": "alice-mix",
        "target_playlist_name": "Alice mix",
        "source_playlist_ids": [],
        "algorithm_name": "BasicShuffle",
        "algorithm_params": {
          "keep_first": 1
        },
        "schedule_type": "cron",
        "schedule_value": "30 9 * * mon",
        "timezone": "UTC",
        "id": 3,
        "user_id": 1,
        "is_enabled": true,
        "last_run_at": "2026-01-01T12:00:00+00:00",
        "last_status": "success",
        "last_error": null,
        "created_at": "2026-01-01T12:00:00+00:00",
        "updated_at": "2026-01-01T12:00:00+00:00"
      },
      "definition": {
        "job_type": "shuffle",
        "target_playlist_id": "alice-mix",
        "target_playlist_name": "Alice mix",
        "source_playlist_ids": [],
        "algorithm_name": "BasicShuffle",
        "algorithm_params": {
          "keep_first": 1
        },
        "schedule_type": "cron",
        "schedule_value": "30 9 * * mon",
        "timezone": "UTC"
      },
      "schedule_revision": "fixture-revision",
      "timing": {
        "kind": "weekly",
        "timezone": "UTC",
        "text": "Every day",
        "schedule_type": "cron",
        "schedule_value": "30 9 * * mon",
        "effective_timezone": "UTC",
        "legacy": false,
        "explanation": null,
        "time": "09:30",
        "weekday": "mon"
      },
      "registration": {
        "status": "unavailable",
        "next_run_at": null,
        "effective_timezone": "UTC"
      },
      "state": "needs_attention",
      "state_label": "Saved\u2014registration needs attention"
    },
    {
      "schedule_id": 4,
      "schedule": {
        "job_type": "shuffle",
        "target_playlist_id": "alice-mix",
        "target_playlist_name": "Alice mix",
        "source_playlist_ids": [],
        "algorithm_name": "BasicShuffle",
        "algorithm_params": {
          "keep_first": 1
        },
        "schedule_type": "cron",
        "schedule_value": "30 9 * * *",
        "timezone": "UTC",
        "id": 4,
        "user_id": 1,
        "is_enabled": true,
        "last_run_at": "2026-01-01T12:00:00+00:00",
        "last_status": "success",
        "last_error": null,
        "created_at": "2026-01-01T12:00:00+00:00",
        "updated_at": "2026-01-01T12:00:00+00:00"
      },
      "definition": {
        "job_type": "shuffle",
        "target_playlist_id": "alice-mix",
        "target_playlist_name": "Alice mix",
        "source_playlist_ids": [],
        "algorithm_name": "BasicShuffle",
        "algorithm_params": {
          "keep_first": 1
        },
        "schedule_type": "cron",
        "schedule_value": "30 9 * * *",
        "timezone": "UTC"
      },
      "schedule_revision": "fixture-revision",
      "timing": {
        "kind": "advanced",
        "timezone": "UTC",
        "text": "Every day",
        "schedule_type": "cron",
        "schedule_value": "30 9 * * *",
        "effective_timezone": "UTC",
        "legacy": false,
        "explanation": null,
        "expression": "0 9 */3 * *"
      },
      "registration": {
        "status": "registered",
        "next_run_at": "2026-01-01T12:00:00+00:00",
        "effective_timezone": "UTC"
      },
      "state": "active",
      "state_label": "Active"
    }
  ],
  "playlists": [
    {
      "id": "alice-mix",
      "name": "Alice mix"
    },
    {
      "id": "bob-mix",
      "name": "Bob mix"
    }
  ]
}
