{
  "success": true,
  "category": "success",
  "routines": [
    {
      "schedule_id": 1,
      "schedule": {
        "job_type": "shuffle",
        "target_playlist_id": "alice-mix",
        "target_playlist_name": "Alice mix",
        "source_playlist_ids": [],
        "algorithm_name": "BasicShuffle",
        "algorithm_params": {
          "keep_first": "2",
          "retired_option": {
            "mode": "custom"
          }
        },
        "schedule_type": "interval",
        "schedule_value": "daily",
        "timezone": "UTC",
        "id": 1,
        "user_id": 1,
        "is_enabled": true,
        "last_run_at": "2026-01-01T12:00:00+00:00",
        "last_status": "success",
        "last_error": null,
        "created_at": "2026-01-01T12:00:00+00:00",
        "updated_at": "2026-01-01T12:00:00+00:00"
      },
      "definition": {
        "job_type": "shuffle",
        "target_playlist_id": "alice-mix",
        "target_playlist_name": "Alice mix",
        "source_playlist_ids": [],
        "algorithm_name": "BasicShuffle",
        "algorithm_params": {
          "keep_first": "2",
          "retired_option": {
            "mode": "custom"
          }
        },
        "schedule_type": "interval",
        "schedule_value": "daily",
        "timezone": "UTC"
      },
      "schedule_revision": "fixture-revision",
      "timing": {
        "kind": "interval",
        "interval": "daily",
        "timezone": "UTC",
        "text": "Every day",
        "schedule_type": "interval",
        "schedule_value": "daily",
        "effective_timezone": "UTC",
        "legacy": false,
        "explanation": null
      },
      "registration": {
        "status": "registered",
        "next_run_at": "2026-01-01T12:00:00+00:00",
        "effective_timezone": "UTC"
      },
      "state": "active",
      "state_label": "Active"
    }
  ],
  "playlists": [
    {
      "id": "alice-mix",
      "name": "Alice mix"
    },
    {
      "id": "bob-mix",
      "name": "Bob mix"
    }
  ]
}
